{
  "schemaVersion": "analysis.v1",
  "resourceId": "44444444-4444-4444-8444-444444444444",
  "model": {
    "name": "fixture-model",
    "promptVersion": "agent-job-llm-v1"
  },
  "analysis": {
    "summary": "프로젝트 제안서 초안에 필요한 목차를 구성했습니다.",
    "keywords": ["문서 초안", "제안서", "목차"],
    "risks": ["근거 문서가 부족하면 세부 일정이 부정확할 수 있습니다."],
    "checklist": [
      {
        "title": "초안에 포함할 근거 문서를 확인합니다.",
        "severity": "LOW"
      }
    ]
  },
  "suggestions": [
    {
      "type": "DOCUMENT_DRAFT",
      "title": "AI/RAG 기능 제안서 초안",
      "description": "개요, 현재 구현 범위, 남은 검증 항목, 운영 설정 순서로 문서 초안을 작성합니다.",
      "contentMarkdown": "# AI/RAG 기능 제안서 초안\n\n## 개요\nAI/RAG 기능 구현 현황을 기준으로 제안서 초안을 작성합니다.\n\n## 현재 구현 범위\n- 자료 분석\n- 임베딩 검색\n- 후보 생성\n\n## 남은 검증 항목\n- 운영 설정 확인\n- 출처 표시 검증\n",
      "sourceText": "AI/RAG 기능 구현 현황을 정리한다.",
      "confidence": 0.81,
      "documentType": "PROJECT_BRIEF"
    }
  ]
}
