{
  "schemaVersion": "analysis.v1",
  "resourceId": "24cf02d3-eb51-4a2c-86f9-428feece0ce6",
  "model": {
    "name": "anthropic.claude-haiku",
    "promptVersion": "p1"
  },
  "analysis": {
    "summary": "계약 범위와 지급 조건을 확인해야 하는 외주 계약서입니다.",
    "keywords": [
      "외주 계약",
      "납품",
      "지급 조건"
    ],
    "risks": [
      "검수 완료 기준이 명확하지 않습니다."
    ],
    "checklist": [
      {
        "title": "검수 완료 조건을 발주처와 합의하세요.",
        "severity": "HIGH"
      }
    ]
  },
  "suggestions": [
    {
      "type": "TASK",
      "title": "검수 완료 조건 확인",
      "sourceText": "검수 완료 후 대금을 지급한다.",
      "confidence": 0.82
    },
    {
      "type": "REQUIREMENT",
      "title": "검수 기준 정의",
      "description": "납품물의 검수 항목과 완료 기준을 문서로 정의합니다."
    },
    {
      "type": "CONTRACT_FIELD",
      "fieldKey": "contract_amount",
      "value": "3000000",
      "confidence": 0.7
    }
  ]
}
