{
  "schemaVersion": "analysis.v1",
  "resourceId": "33333333-3333-4333-8333-333333333333",
  "model": {
    "name": "fixture-model",
    "promptVersion": "agent-job-llm-v1"
  },
  "analysis": {
    "summary": "회의록에서 담당 작업과 후속 질문을 추출했습니다.",
    "keywords": ["회의록", "TODO", "담당자"],
    "risks": ["마감일이 명시되지 않은 작업이 있습니다."],
    "checklist": [
      {
        "title": "담당자와 마감일을 확정합니다.",
        "severity": "MEDIUM"
      }
    ]
  },
  "suggestions": [
    {
      "type": "TASK",
      "title": "업로드 분석 API E2E 검증",
      "description": "샘플 PDF 업로드 후 분석, 검색, 제안 승인 흐름을 Postman으로 검증합니다.",
      "sourceText": "업로드 분석 API는 다음 회의 전까지 실제 파일로 검증한다.",
      "confidence": 0.87
    },
    {
      "type": "QUESTION",
      "title": "검증 샘플 파일 범위 확인",
      "description": "계약서, 회의록, 요구사항 문서 중 어떤 샘플을 필수 검증 대상으로 둘지 확인합니다.",
      "sourceText": "실제 파일로 검증한다.",
      "confidence": 0.74
    }
  ]
}
